{
  "schema_version": "1.1.0",
  "manifest_id": "experiment.observatory-comparison.synthetic-v1",
  "classification": "synthetic-research-proposal",
  "protocol_ref": {
    "artifact_id": "protocol.observatory-comparison.v1",
    "artifact_type": "research-protocol-contract",
    "path": "experiments/observatory-comparison/fixtures/protocol-contract.synthetic.json",
    "sha256": "sha256:e289196d603f6dc7f814ed82aaaf3b613544c7ce903e121cd052599505e77adc"
  },
  "source_transition_bundle": {
    "bundle_id": "bundle.round-04.worker-option.pre-projection",
    "bundle_stage": "pre-projection-core",
    "schema_version": "1.2.0",
    "path": "integration/transition-bundle/fixtures/round-04.worker-option.pre-projection.json",
    "sha256": "sha256:d10caddf192c69068f1598f4290882a23094e1d5d3840fa0f48fe1a61cabd225"
  },
  "fact_pack": {
    "fact_pack_id": "fact-pack.observatory-comparison.synthetic-v1",
    "path": "experiments/observatory-comparison/fixtures/shared-fact-pack.synthetic.json",
    "sha256": "sha256:4d97ae0f68ad723e4e008f550f33be5a5b9b1b30d3ee51a085bca4f933ccf46f"
  },
  "arms": [
    {
      "arm_id": "arm.conventional-release",
      "instrument_kind": "conventional-release",
      "instrument_ref": {
        "artifact_id": "instrument.conventional-release.synthetic-v1",
        "artifact_type": "instrument-specification",
        "path": "experiments/observatory-comparison/fixtures/instrument-conventional.synthetic.json",
        "sha256": "sha256:dd0853b29d5d2e9c0db47ac372fa6450d4ea93524a23f9d300be8e6ab10925f2"
      },
      "fact_pack_ref": {
        "fact_pack_id": "fact-pack.observatory-comparison.synthetic-v1",
        "path": "experiments/observatory-comparison/fixtures/shared-fact-pack.synthetic.json",
        "sha256": "sha256:4d97ae0f68ad723e4e008f550f33be5a5b9b1b30d3ee51a085bca4f933ccf46f"
      },
      "deliberation_script_ref": null,
      "outcome_contract_ref": {
        "artifact_id": "outcomes.observatory-comparison.synthetic-v1",
        "artifact_type": "outcome-contract",
        "path": "experiments/observatory-comparison/fixtures/outcome-contract.synthetic.json",
        "sha256": "sha256:49585332d0c0c1d34d5a20c86c33ee980daaed70e7c00ce875f1c3b351dce123"
      },
      "allocation_weight": 1
    },
    {
      "arm_id": "arm.release-plus-deliberation",
      "instrument_kind": "release-plus-deliberation",
      "instrument_ref": {
        "artifact_id": "instrument.release-plus-deliberation.synthetic-v1",
        "artifact_type": "instrument-specification",
        "path": "experiments/observatory-comparison/fixtures/instrument-release-deliberation.synthetic.json",
        "sha256": "sha256:84340ecf1710438b4a4e9ab3870579583503e3387eb67b6fc72b72ec58f5761c"
      },
      "fact_pack_ref": {
        "fact_pack_id": "fact-pack.observatory-comparison.synthetic-v1",
        "path": "experiments/observatory-comparison/fixtures/shared-fact-pack.synthetic.json",
        "sha256": "sha256:4d97ae0f68ad723e4e008f550f33be5a5b9b1b30d3ee51a085bca4f933ccf46f"
      },
      "deliberation_script_ref": {
        "artifact_id": "script.observatory-comparison.synthetic-v1",
        "artifact_type": "deliberation-script",
        "path": "experiments/observatory-comparison/fixtures/deliberation-script.synthetic.json",
        "sha256": "sha256:ca5d0876de846803ebe392424fce7b9524cc9b7377a5f05f2d3f7562dfa2e2de"
      },
      "outcome_contract_ref": {
        "artifact_id": "outcomes.observatory-comparison.synthetic-v1",
        "artifact_type": "outcome-contract",
        "path": "experiments/observatory-comparison/fixtures/outcome-contract.synthetic.json",
        "sha256": "sha256:49585332d0c0c1d34d5a20c86c33ee980daaed70e7c00ce875f1c3b351dce123"
      },
      "allocation_weight": 1
    },
    {
      "arm_id": "arm.observatory-self-serve",
      "instrument_kind": "observatory-self-serve",
      "instrument_ref": {
        "artifact_id": "instrument.observatory-self-serve.synthetic-v1",
        "artifact_type": "instrument-specification",
        "path": "experiments/observatory-comparison/fixtures/instrument-observatory-self-serve.synthetic.json",
        "sha256": "sha256:8735ea6104330376d7c6ac3520595b63f201ef22e24f0755db39ef160090f2e6"
      },
      "fact_pack_ref": {
        "fact_pack_id": "fact-pack.observatory-comparison.synthetic-v1",
        "path": "experiments/observatory-comparison/fixtures/shared-fact-pack.synthetic.json",
        "sha256": "sha256:4d97ae0f68ad723e4e008f550f33be5a5b9b1b30d3ee51a085bca4f933ccf46f"
      },
      "deliberation_script_ref": null,
      "outcome_contract_ref": {
        "artifact_id": "outcomes.observatory-comparison.synthetic-v1",
        "artifact_type": "outcome-contract",
        "path": "experiments/observatory-comparison/fixtures/outcome-contract.synthetic.json",
        "sha256": "sha256:49585332d0c0c1d34d5a20c86c33ee980daaed70e7c00ce875f1c3b351dce123"
      },
      "allocation_weight": 1
    },
    {
      "arm_id": "arm.observatory-plus-deliberation",
      "instrument_kind": "observatory-plus-deliberation",
      "instrument_ref": {
        "artifact_id": "instrument.observatory-plus-deliberation.synthetic-v1",
        "artifact_type": "instrument-specification",
        "path": "experiments/observatory-comparison/fixtures/instrument-observatory-deliberation.synthetic.json",
        "sha256": "sha256:f30b73f6f536e21adba5bb793300ab0196010b752c957b53eb7ac9c0a656fcce"
      },
      "fact_pack_ref": {
        "fact_pack_id": "fact-pack.observatory-comparison.synthetic-v1",
        "path": "experiments/observatory-comparison/fixtures/shared-fact-pack.synthetic.json",
        "sha256": "sha256:4d97ae0f68ad723e4e008f550f33be5a5b9b1b30d3ee51a085bca4f933ccf46f"
      },
      "deliberation_script_ref": {
        "artifact_id": "script.observatory-comparison.synthetic-v1",
        "artifact_type": "deliberation-script",
        "path": "experiments/observatory-comparison/fixtures/deliberation-script.synthetic.json",
        "sha256": "sha256:ca5d0876de846803ebe392424fce7b9524cc9b7377a5f05f2d3f7562dfa2e2de"
      },
      "outcome_contract_ref": {
        "artifact_id": "outcomes.observatory-comparison.synthetic-v1",
        "artifact_type": "outcome-contract",
        "path": "experiments/observatory-comparison/fixtures/outcome-contract.synthetic.json",
        "sha256": "sha256:49585332d0c0c1d34d5a20c86c33ee980daaed70e7c00ce875f1c3b351dce123"
      },
      "allocation_weight": 1
    }
  ],
  "safety": {
    "approval_state": "not-approved",
    "recruitment_state": "blocked",
    "participant_data_collection": "disabled",
    "ethics_review": "pending",
    "privacy_review": "pending",
    "independent_monitor": {
      "identity_state": "unverified",
      "monitor_id": null
    },
    "support_route": {
      "state": "pending",
      "route": null
    },
    "stop_rules": [
      {
        "rule_id": "stop.urgent-irreversible-intent",
        "measure": "urgent-irreversible-action-intention",
        "operator": "any",
        "threshold": 1,
        "strata": [
          "all-participants",
          "directly-affected"
        ],
        "effect": "pause-and-independent-review",
        "compensation_across_strata": "forbidden"
      },
      {
        "rule_id": "stop.dangerous-understanding",
        "measure": "dangerous-understanding-increase",
        "operator": "gt",
        "threshold": 0,
        "strata": [
          "all-participants",
          "directly-affected",
          "low-numeracy",
          "limited-english"
        ],
        "effect": "pause-and-independent-review",
        "compensation_across_strata": "forbidden"
      },
      {
        "rule_id": "stop.serious-reported-harm",
        "measure": "serious-anxiety-stigma-dignity-or-blame-report",
        "operator": "any",
        "threshold": 1,
        "strata": [
          "all-participants",
          "directly-affected"
        ],
        "effect": "pause-and-independent-review",
        "compensation_across_strata": "forbidden"
      },
      {
        "rule_id": "stop.missing-no-real-service-notice",
        "measure": "no-real-service-warning-or-authority-notice-missed",
        "operator": "any",
        "threshold": 1,
        "strata": [
          "all-participants"
        ],
        "effect": "pause-and-independent-review",
        "compensation_across_strata": "forbidden"
      },
      {
        "rule_id": "stop.critical-access-failure",
        "measure": "critical-assistive-technology-path-failure",
        "operator": "any",
        "threshold": 1,
        "strata": [
          "assistive-technology"
        ],
        "effect": "pause-and-independent-review",
        "compensation_across_strata": "forbidden"
      },
      {
        "rule_id": "stop.privacy-exposure",
        "measure": "personal-data-outside-approved-minimum",
        "operator": "any",
        "threshold": 1,
        "strata": [
          "all-participants"
        ],
        "effect": "pause-and-independent-review",
        "compensation_across_strata": "forbidden"
      }
    ]
  },
  "contract_boundary": {
    "truth_effect": "none",
    "authority_effect": "none",
    "ethics_approval_effect": "none",
    "recruitment_effect": "none",
    "parity_effect": "declared-input-binding-only",
    "source_projection_effect": "coherent-pre-projection-core-only"
  }
}
